,url,title,date,country,id,text
0,https://menafn.com/1103850963/Fox-News-Pierre-Zakrzewski-killed-reported-wounded-in-Ukraine&source=138,"Fox New Pierre Zakrzewski killed , reported wounded in Ukra ... ",17/03/2022,Qatar,43b620e7-6475-08bb-e546-6bccb27984a3,"(MENAFN- UkrinForm) Veteran Fox News cameraman Pierre Zakrzewski has died after his vehicle was struck by incoming fire in Horenka, outside Kyiv on Monday.

That's according to Fox News Media CEO Suzanne Scott, who broke the news Tuesday.

Fox News journalist Benjamin Hall was with Zakrzewski while newsgathering and was also injured. Hall remains hospitalized, Scott said.

'Pierre was a war zone photographer who covered nearly every international story for FOX News from Iraq to Afghanistan to Syria during his long tenure with us,' the report says. 'His passion and talent as a journalist were unmatched. Based in London, Pierre had been working in Ukraine since February.'

Invaders take hostage doctors, patients of intensive care hospital in Mariupol

As Ukrinform reported earlier, Fox News reporter John Roberts said on Monday that the channel's journalist was injured outside Kyiv while covering Russian aggression against Ukraine.

The day before, in Irpin near Ukraine's capital, Russian soldiers shot dead Time journalist Brent Renauld. He was killed on the spot after being shot in the head. Another journalist, Juan Diego Arredondo, was wounded and evacuated to Okhmatdyt Hospital in Kyiv.

Photo: Fox News"
1,https://www.arkansasonline.com/news/2022/mar/17/killing-raises-death-toll-to-8-for-journalists-in/,Killing raises death toll to 8 for journalists in Mexico,17/03/2022,United States,8696fd24-49d8-ec0b-e03a-3c8d28eec378,"ZITACUARO, Mexico -- A journalist was shot to death in Mexico on Tuesday, marking the eighth this year in a spate of killings that has made Mexico the most dangerous place in the world for the press.

Six weeks ago, journalist Armando Linares choked up in a video announcing the killing of a colleague and promised to continue doing journalism that exposed the corrupt. Linares continued to publish the Monitor Michoacan online news site after the death of camera operator Roberto Toledo, writing stories about the monarch butterflies that winter in the mountains around Zitacuaro, butterfly-related festivities and other hyperlocal and state news -- occasionally including criticism of local officials.

On Jan. 31, the day Toledo was killed, Linares looked straight at the camera and said: ""There are names. We know where all of this comes from.""

""The Monitor Michoacan team has been suffering a series of death threats,"" he said. ""Exposing the corruption of corrupt governments, corrupt officials and politicians today has led to the death of one of our friends.""

Linares told reporters shortly afterward that he had continued receiving threats, that he had enrolled in the federal government's protection program for journalists and that he was receiving protection from the National Guard.

But on Tuesday evening, he was shot and killed at his Zitacuaro home. His body was found in the doorway, and he had gunshots in the chest, according to the state prosecutor's office. Authorities recovered 9mm shell casings at the scene.

President Andres Manuel Lopez Obrador, speaking at his daily news conference on Wednesday, said Linares had not accepted protection, raising the question of whether he had left the program at some point.

""Michoacan's journalists ask all public servants to save their condolences,"" reporter Rodolfo Montes said during the president's news conference. ""There is indignation ... there is fury, there is impotence at this wave of killings.""

Lopez Obrador repeated his promise that there would not be impunity in Linares' case and said there was no evidence that public servants were responsible. But at another point, the president continued his frequent attacks on the press, alleging ""lies"" and calling some ""mercenaries.""

In Michoacan's state legislature, dozens of journalists stood at the front of the chamber holding signs that read: ""Pacifist government doesn't kill journalists"" and ""Press. Don't shoot.""

A journalist group called ""Not one more Michoacan"" said in a statement that ""the calls to be alert and help from Armando where not listened to."" It also criticized the state and federal governments for disparaging the professionalism of Monitor Michoacan and downplaying the threats its staff faced.

The killings of journalists have been coming at a rate of nearly one per week this yearin Mexico. Advocates and the government have placed much of the blame on the high rate of impunity in killings of journalists and human rights defenders -- as well as other Mexicans.

Jan-Albert Hootsen, the representative in Mexico for the U.S.-based Committee to Protect Journalists who had spoken with Linares after Toledo's killings, lamented his death.

""In a world where disinformation and manipulating every narrative is an objective brutally pursued by those with power and willing to use deadly violence, journalists are legitimate targets and impunity is the most powerful tool to silence them,"" he said.

Linares did not want Toledo's killing to go unpunished. In his video, he addressed his colleague's family: ""We aren't going to leave things like this. We are going to take them to their ultimate consequences.""

Information for this article was contributed by Maria Verza of The Associated Press."
2,https://www.ctpost.com/news/article/Mexican-journalist-killed-6-weeks-after-17006919.php,Mexican journalist killed 6 weeks after colleague murder,17/03/2022,United States,e56fb0c5-a64e-0805-711f-cd5a33ac0908,"ZITACUARO, Mexico (AP) — Six weeks ago, journalist Armando Linares choked up in a video announcing the killing of a colleague and promised to continue doing journalism that exposed the corrupt. Now Linares too has been gunned down — the eighth journalist killed in Mexico this year.

On Wednesday, his wife, children, siblings and friends prepared to see him off inside a small funeral parlor.

After initially halting his reporting for a few weeks and closing the Monitor Michoacan office following the killing of camera operator Roberto Toledo, Linares returned to reporting and resumed publishing the online news site.

He wrote stories about the monarch butterflies that winter in the mountains around Zitacuaro, butterfly-related festivities and other hyper-local and state news — but gone was the criticism of local officials he was known for before Toledo's killing.

Still, the threat for journalists had persisted, something Linares seemed to expect.

On Jan. 31, the day Toledo was killed, Linares looked straight at the camera and said, “There are names. We know where all of this comes from.”

“The Monitor Michoacan team has been suffering a series of death threats,” he said. “Exposing the corruption of corrupt governments, corrupt officials and politicians today has led to the death of one of our friends.”

Linares told The Associated Press shortly afterward that he had continued receiving threats, enrolled in the federal government’s protection program for journalists and was receiving protection from the National Guard.

“He never gave in to anyone,” said Liares' wife Rosa Elena Pedraza. “He died doing what he liked, he was a courageous man.”

She said Linares had government protection for a month after Toledo's killing, but said later it was lifted. “If everything is calm they take away the protection,” she said.

On Tuesday evening, Linares was shot and killed at his Zitacuaro home. His body was found in the doorway with gunshots to the chest, according to the state prosecutor's office. Authorities recovered 9mm shell casings at the scene. Authorities have not provided a suspected motive.

Magdalena Alonso, director of the news program Zitacuaro on the Air and a friend of Linares, said “for many motives it's easy for them to attack you ... because there isn't much security nor do authorities feel responsible for providing it.”

Illustrating that point, an unidentified man approached a group of journalists Wednesday afternoon gathered in the entrance to the funeral home. He showed them a pistol hidden inside his clothing and told them they had two minutes to leave.

President Andrés Manuel López Obrador, speaking at his daily news conference on Wednesday, said Linares had not accepted protection.

“Michoacan’s journalists ask all public servants to save their condolences,” reporter Rodolfo Montes said during the president’s news conference. “There is indignation ... there is fury, there is impotence at this wave of killings.”

López Obrador repeated his promise that there would not be impunity in Linares’ case and said there was no evidence public servants were responsible. But at another point, the president continued his frequent attacks on the press, alleging “lies” and calling some “mercenaries.”

In Michoacan’s state legislature, dozens of journalists stood at the front of the chamber holding signs that read: “Pacifist government doesn’t kill journalists” and “Press. Don’t shoot.”

A journalist group called “Not one more Michoacan” said in a statement that “the calls to be alert and help from Armando where not listened to.” It also criticized the state and federal governments for disparaging the professionalism of Monitor Michoacan and downplaying the threats its staff faced.

The killings of journalists have been coming at a rate of nearly one per week this year, an unprecedented spate of violence against the profession in Mexico. Advocates and the government have placed much of the blame on the high rate of impunity in killings of journalists and human rights defenders — as well as ordinary Mexicans.

Jan-Albert Hootsen, the representative in Mexico for the U.S.-based Committee to Protect Journalists who had spoken with Linares after Toledo’s killings, lamented his death.

“In a world where disinformation and manipulating every narrative is an objective brutally pursued by those with power and willing to use deadly violence, journalists are legitimate targets and impunity is the most powerful tool to silence them,” he said via Twitter.

Interior Undersecretary Alejandro Encinas said Wednesday during a freedom of expression event at the Norwegian embassy that “if there is not prevention, if there is not investigation and there isn’t punishment, impunity will continue prevailing in these incidents.”

Linares did not want Toledo's killing to go unpunished. In his video, he addressed his colleague's family: “We aren't going to leave things like this. We are going to take them to their ultimate consequences.”

___

AP writer María Verza in Mexico City contributed to this report."
3,https://www.newdelhitimes.com/spanish-newspaper-criticizes-china-for-pressuring-reporters/,Spanish Newspaper Criticizes China for Pressuring Reporters - New Delhi Times - India Only International Newspaper,17/03/2022,United States,ef8a31c6-e574-1c56-680b-e0a182c71c74,"Tensions increased between one of Spain’s largest newspapers and China this month, when police in Beijing visited the home of one of the media outlet’s correspondents.

The Spanish daily ABC and its reporter Jaime Santirso both described the incident as “veiled intimidation.”

In a tweet thread on March 8, Santirso said that three members of the police visited his Beijing home on the eve of the National People’s Congress, the most important political event of the year in China.

Beijing has pushed back on ABC’s coverage in recent months, with its embassy in Madrid publicly condemning a series of articles and China’s Foreign Ministry late last year summoning the ABC bureau chief to complain about his reporting. Access to the ABC website has been blocked in China since last year.

Santirso and ABC declined to speak with VOA. But their experiences reflect the increasing challenges foreign media face in Beijing, according to media bodies, including the Foreign Correspondents’ Club of China and the International Federation of Journalists, or IFJ.

The IFJ condemned the “wolf warrior diplomacy” employed by China toward Spanish journalists and said the country shows a well-known pattern of intimidation toward foreign media.

Taken from a film, “wolf warrior diplomacy” refers to a more aggressive approach adopted by some Chinese officials.

“The IFJ has documented a clear pattern of harassment or intimidation of journalists from countries that do not follow in step with China’s line, particularly on any sensitive topics. It is this type of intimidation that has forced other correspondents to leave their posts or relocate,” Jane Worthington, IFJ’s regional director, told VOA.

“Wolf warrior diplomacy and pressure from the state, combined with outright blocking like this, is part of a strategy to control the media narrative and attack foreign journalists’ independence,” Worthington added.

Santirso was not at home when the police visited. But on Twitter he said they spoke with his wife.

“Very kindly, they [the police] said that they wanted me to do balanced coverage of the [congress], with not only bad news but good news. A while later, they left,” Santirso said in a Twitter thread.

“This episode, a police raid in the private home of a journalist with the explicit purpose of influencing the tone and content of his work, is by no means a common practice and no other colleague has experienced something similar recently,” Santirso tweeted.

As a journalist and Beijing resident for eight years, Santirso said he has had several interactions with authorities and security forces over the years, “the vast majority of them have been cordial.”

“This in its way, was, too. At its heart, however, was a veiled intimidation!” he added.

Back in Spain, ABC responded to the incident in an editorial.

“This veiled intimidation, with the explicit intention to influence the tone and content of [Santirso’s] reporting, represents a worrying advance in the hostility toward international media by the Chinese government,” the editorial read.

It was not the first brush between the Spanish paper and the Chinese government.

In November, China’s Foreign Ministry summoned ABC bureau chief Pablo Diez. Officials wanted to correct some “errors” in a profile about President Xi Jinping.

Diez, who did not want to comment to VOA for this article, had described China in the piece as a “dictatorship.”

Around the same time, he wrote an article about tennis player Peng Shuai and other celebrities whom he said disappeared after falling out with or criticizing the Chinese government.

Peng disappeared from public after accusing Zhang Gaoli, China’s former vice-premier under Xi, of sexual assault in a November post to the social media platform Weibo. The post was taken down minutes later. Zhang did not publicly comment on the allegations.

In an interview with a French sports magazine in February, Peng denied saying anyone had assaulted her and said she removed the Weibo post herself.

The Chinese Embassy in Madrid published criticism of the ABC articles on its website, in which it named Diez, and said his articles were “full of ignorance, bias and lies.”

The embassy said that Diez’s reporting is “unscrupulously discrediting China and its leader, seriously violating the basic principles of journalism, such as objectivity and neutrality, and misleading the Spanish people about China.”

Shortly after the articles were published, access to ABC’s website was blocked in China.

VOA tried to contact the Chinese Embassy in Madrid for comment, but its calls went unanswered.

The Spanish Foreign Ministry is said to have complained to China’s embassy in Madrid and Foreign Ministry in Beijing about the criticism, sources familiar with the case told VOA.

Spain’s Foreign Ministry did not respond to VOA’s request for comment.

Chinese officials overseas are known to call journalists and media outlets to complain about coverage, media rights groups say.

A report by the Foreign Correspondents’ Club of China in 2021 also found that international journalists are facing “unprecedented hurdles” because of Beijing’s efforts to block and discredit independent reporting.”

“As the number of journalists forced out by the Chinese state grows due to excessive intimidation or outright expulsions, covering China is increasingly becoming an exercise in remote reporting,” the report said.

Journalists also are at risk of arrest. Haze Fan, a member of the Bloomberg News bureau in Beijing, has been detained since December 2020.

Chinese officials said at the time that Fan was detained by the Beijing National Security Bureau on suspicion of national security law violations.

“We are all very worried about her very well-being and we will continue to do everything we can to help her and her family,” John Micklethwait, editor-in-chief of Bloomberg News, said in a statement.

Credit : Voice of America (VOA)

Photo Credit : Wikimedia commons

Like this: Like Loading..."
4,https://cpj.org/2021/09/togolese-journalists-spyware-surveillance/,  There is no private life : Three Togolese journalists react to being selected for spyware surveillance,16/03/2022,China,d1ba5791-7b0a-fefb-9a6b-eb7451f3c497,"Share this: Twitter

Facebook

WhatsApp

LinkedIn

Email

Telegram



When Komlanvi Ketohou fled Togo in early 2021, he left behind his home, his family, and his cell phone that the gendarmerie seized when they arrested and detained him over a report published by his newspaper, L’Independant Express. In July, Ketohou, who goes by Carlos, learned that the phone number connected to the device they took may have been targeted for surveillance years before his arrest.

The revelation came via the Pegasus Project, a collaborative global media investigation detailing how thousands of leaked phone numbers, including many that belonged to journalists, were allegedly selected for potential surveillance by clients of the Israeli firm NSO Group. In addition to Ketohou, Togolese journalist Ferdinand Ayité, director of L’Alternative newspaper, was also on the Pegasus Project list, according to Forbidden Stories, one of the project’s partners. A third Togolese journalist, freelancer Luc Abaki, was similarly selected as a potential spyware target, according to a representative from Amnesty International, another of the project’s partners, who confirmed his number’s listing to Abaki and then to CPJ.

Ferdinand Ayité (left), director of Togolese newspaper L’Alternative, and freelance reporter Luc Abaki (right) learned that their phone numbers were allegedly selected for potential surveillance. (Photos: Ferdinand Ayité and Luc Abaki)

The use of NSO Group’s Pegasus spyware on these journalists’ phones has not been confirmed and NSO Group denied any connection to the list. But the three journalists told CPJ in multiple interviews conducted via email, phone, and messaging app that learning of their status as potential surveillance targets heightened their sense of insecurity, even as they continue to work in the profession.

“I spent nightmarish nights thinking about all my phone activities. My private life, my personal problems in the hands of strangers,” Ketohou said. “It’s scary. And it’s torture for me.”

The potential use of Pegasus spyware to surveil journalists in Togo adds to an already lengthy list of the country’s press freedom concerns. In recent years, journalists in Togo have been arrested and attacked, had their newspapers suspended over critical coverage, and struggled to work amid disrupted access to internet and messaging apps, CPJ has documented.

NSO Group has said it only sells its spyware, which allows the user to secretly monitor a target’s phone, to governments for use investigating crime and terrorism. Yet Pegasus has been repeatedly used to target members of civil society around the world, including Togolese clergy in 2019, according to Citizen Lab, a University of Toronto-based research group which investigates spyware. Over 300 Togolese numbers appeared on the Pegasus Project list of potential targets, Le Monde, another partner in the project, reported.

“I was very afraid,” Ketohou told CPJ after he said he was informed by Forbidden Stories that his number was listed in 2017 and 2018. He said it confirmed his decision to go into exile, where he started a new news site, L’Express International, after Togo’s media regulator barred L’Independant Express from publishing in early 2021 as CPJ documented. He asked CPJ not to disclose his location for security reasons.

Ketohou told CPJ that he couldn’t point to a specific article that may have triggered potential surveillance, but said that at the time his phone was selected his newspaper was reporting on nationwide protests—which began in 2017—opposing President Faure Gnassingbé’s rule. His position at the time as president of the Togolese Press Patronage, a local media owners association, and membership in the Togolese League for Human Rights (LTDH) advocacy group may have contributed to interests in having his phone monitored, Ketohou added.

L’Alternative director Ayité told CPJ that he was not certain what caused his phone number to be selected in 2018, as Forbidden Stories informed him, but that year his newspaper published what he described as “sensitive” reports on the political crisis surrounding the protests and the mediation efforts by surrounding countries.

He said the selection of his number for potential surveillance fit a pattern of Togolese authorities’ efforts to intimidate him and L’Alternative.

In February, CPJ documented how Togo’s media regulator for the second time in less than a year suspended L’Alternative; Ayité told CPJ in late July that the suspension ended in June. In a separate incident, in November 2020 a local court ordered Ayité and L’Alternative each to pay 2 million Western African francs (US$3,703) in damages to a Togo official who complained that their reporting on his alleged embezzlement violated the country’s press code; Ayité told CPJ that he has appealed the court order and that the next hearing is scheduled to be held on October 10.

Unlike the other two journalists, Abaki said he was taking a break from journalism in 2018, the year he was listed for potential targeting, according to the Amnesty International representative.

But Abaki, who has been freelancing since last year, has also had his journalism impeded by authorities. In 2017, Togo’s media regulator closed La Chaîne du Futur and City FM, the television and radio stations he directed at the time, over alleged administrative issues, according to the government of Togo’s website. Abaki told CPJ that the closure was a political reprisal against a local politician who owned the station.

CPJ’s questions to Togo’s Broadcast and Communications High Authority, sent via the contact page on its website, as well as by text message to its president, Willybrond Télou Pitalounani, went unanswered.

Abaki said that being listed for surveillance was “extremely traumatic,” adding “there is no private life.”

“I told myself that I could have died, since the other journalists targeted from the other countries were murdered,” Ketohou told CPJ.

The Guardian reported that around the time Saudi Washington Post columnist Jamal Khashoggi was killed in 2018, phones belonging to his associates and family, including his wife and fiancée, were targeted with Pegasus spyware. Separately, The Guardian also reported that freelance Mexican journalist Cecilio Pineda Birto was selected for surveillance with the spyware a month before his assassination in 2017. Spyware attacks often occur alongside other press freedom violations, CPJ has found.

“There is a huge psychological impact of knowing that someone in this country is taking control of your phone, violating your privacy,” Ayité told CPJ, adding that his broader safety and privacy concerns had already caused him to limit his dating and other personal relationships. “I will be even more careful and vigilant you never know where the fatal blow will come from. I am a journalist on borrowed time.”

CPJ’s calls to Akodah Ayewouadan, Togo’s minister of communication and spokesperson for the government, rang unanswered. In July, President Gnassingbé said he “can’t confirm” the use of Pegasus spyware to target his political opponents, according to Le Monde. “Each sovereign state is organizing itself to face what threatens it with the means at its disposal,” he said.

In an email to CPJ, NSO Group said that “NSO will thoroughly investigate any credible proof of misuse of its technologies” and “will shut down the system where necessary.” NSO did not directly respond to CPJ’s questions about the mental health implications of its technology’s sale and use.

Meanwhile, Ketohou has vowed to plow ahead with his journalistic work. “I have increased security around me, my internet activities, my work,” he said. But the experience, he added, “did not deter or intimidate me in my work as a journalist or human rights defender.”"
