,url,title,date,country,id,text
12,https://island.lk/un-rights-chief-seeks-foreign-prosecutions-for-sri-lanka/,UN rights chief seeks foreign prosecutions for Sri Lanka,06/03/2022,Sri Lanka,18710986-aa14-0217-304f-f4d9a0fb4246,"The UN rights chief called Friday for sanctions and international prosecutions of Sri Lankan war criminals, saying Colombo had repeatedly failed to ensure accountability for wartime atrocities.

UN High Commissioner for Human Rights Michelle Bachelet made the comments a day after British police announced the first overseas arrest over war crimes allegations in Sri Lanka.

The island nation had drifted towards “militarisation” under President Gotabaya Rajapaksa, a retired army lieutenant colonel, and the rights situation was deteriorating, Bachelet said.

“In the last two years, the independence of the judiciary… and other key institutions have been eroded, and democratic space, including for human rights advocacy constricted,” she said.

In a report to be unveiled at the UN Human Rights Council sessions reviewing Sri Lanka’s record next week, she also noted that the state had dropped investigations into emblematic cases.

“There has been a further drift towards militarisation,” she said, accusing Colombo of protecting military officers facing allegations and even giving them high positions in the administration.

She urged UN Human Rights Council member states to invoke universal jurisdiction and prosecute Sri Lankan officials facing credible allegations of war crimes.

Successive Sri Lankan governments have promised but failed to investigate their own troops accused of killing thousands of Tamil civilians in the final months of the island’s decades-long Tamil separatist war.

The fighting ended in May 2009 following a no-holds-barred military offensive that crushed minority Tamil guerrillas known for their suicide bombings.

Bachelet asked member states to “explore the possibility of targeted sanctions against credibly alleged perpetrators of grave human rights violations and abuses” in Sri Lanka.

The appeal came a day after the arrest of a suspect by British war crimes police over a 2000 murder of a high-profile journalist in Sri Lanka’s northern Tamil heartland of Jaffna, where much of the fighting was concentrated.

London’s Metropolitan Police war crimes team on Thursday announced the arrest of a 48-year-old man in Northamptonshire in connection with the murder of Tamil reporter Mylvaganam Nimalrajan.

British police can investigate anyone who may fall under British jurisdiction and is suspected of committing war crimes, crimes against humanity, genocide or torture anywhere in the world under a “no safe haven” policy.

Sri Lankan authorities fear the arrest of the as-yet-unnamed suspect could set a precedent for the detention of current military officers or government officials.

Jayanath Colombage, the top civil servant at the foreign ministry, told reporters in Colombo — before an advance draft of Bachelet’s report was released — that the British move could have implications for current office-holders.

“Invoking universal jurisdiction is another very debatable topic,” he said.

“Any country can use this as an excuse to target people of another country,” he added, calling it a “very big danger”.

“So we need to be prepared for that.”

Western nations have imposed travel bans on Sri Lankan military officials, including current army chief Shavendra Silva.

Colombo has rejected a UN mechanism set up last year to preserve evidence following allegations that Sri Lankan troops killed at least 40,000 civilians in the final months of the war."
13,https://hetq.am/en/article/141464,"Four Years After Journalist Murder , Slovakia Has Changed",22/02/2022,Armenia,06b2688b-83db-2c9f-f49c-6fe892653680,"By Pavla Holcová, Eva Kubaniova

On February 21, 2018, at exactly 8:21pm, Slovakia changed forever.

Ján Kuciak, a young investigative reporter, and his fiancée, Martina Kušnírová, were drinking coffee in their home in the small Slovak village of Velká Mača when a man knocked on their front door wielding a 9mmn Luger.

Within seconds, both were shot dead: Ján crumpled on the basement stairs, Martina in the kitchen.

The two were murdered at the unbearably young age of 27. Their deaths — widely connected with Ján’s work to expose corruption — inspired the biggest protests in Slovakia since the fall of communism.

The ruling party fell, but that was just the first domino. Evidence secured in the murder probe led to new investigations. In the past four years, thirteen judges have been charged with obstruction of justice and corruption. One police president committed suicide, a second is under investigation, and a third — the one who initially oversaw the murder case — has been charged with heading an organized criminal group.

But the arrests do not mean that all is well. A special court trying Ján and Martina’s murder found the lead suspects — including Marian Kočner, the notorious businessman accused of masterminding the crime — not guilty due to lack of evidence. And none of the arrested judges or police officials have gone to trial, let alone been sentenced. Voices from the reform movement are conflicted on how to move forward: Though Slovakia’s politics have changed, the country’s new leaders have not fulfilled the people’s hopes. The ugly face of the old system, many say, is trying to stage a comeback.

“The murder of Ján Kuciak and Martina Kušnírová brought hope to Slovak society,” says sociologist Michal Vašečka. “It existed for two years. But the new prime minister and the COVID situation flushed the hope down the sewer.”

“We Never Chose This”

In 2018, in the weeks and months after the murder of their children, the Kuciak and Kušnírova families were asked by organizers of anti-corruption demonstrations to speak out. Their challenge was not only to mourn, but also to gather the courage to speak in front of tens of thousands of people.

“We never chose this,” Ján’s father Jozef said.

“I never would have done it. But I felt I had for Martina, my daughter,” recalls Zlata Kušnírova. “So I went to the protests and talked to the huge crowds. I cried so much I couldn’t even read my prepared words, so I just spoke from my heart.”

The families received letters of support, but were also targeted by strange acts of hatred.

Someone repeatedly vandalized the flowers laid on Martina’s grave.

“It drove me crazy,” her mother said. “So I put a sign on the doors of a local shop, ‘If you want to talk to me, let’s please talk. If you don’t have flowers, I will buy you some. And if you need a vase, I’ll lend you one of mine. Please leave Martina’s grave untouched, she never did anything bad to you!’”

“Once, I received a letter that my son was a CIA agent. It was anonymous,” said Jozef Kuciak. “I tore it to pieces and threw it away. It was bullshit.”

The Kuciak family lives in a small village in the hills of northwest Slovakia. When reporters visited their home in 2018, the garden was covered in snow. Behind the front door sat two big boxes of candles.

“Every day I visit the grave of my son,” said Ján’s mother Jana, pointing to the candles. “It’s four kilometers there and back. If there is no one to take me by car, I walk or ride a bike. I must go there every day, no matter what.”

Since that first visit, the house has been remodeled. In the corner, where there used to be a wooden stove, hangs a small memorial with photos of Martina, Ján, and the journalism awards he posthumously received.

Finding the Killers

Initially, neither family believed that their child’s murder would be properly investigated.

Nor did Peter Juhás, the young policeman appointed to lead the investigation. “It was obvious from the crime scene that the assassination was committed by a professional,” he said. “We thought it could be a professional killer from abroad, no longer in Slovakia.”

But in Spring 2018, Juhás got the feeling they were close to a homegrown culprit.

“I can recall the moment, probably in March or April, when I told one of the lawyers: ‘my intuition says we’re on the right path, and we can really move forward in the upcoming months.’”

He was right. In September 2018, police raided several houses in a small town in southern Slovakia. Eight people were detained, three of whom were later charged with planning and carrying out the assassination. One of them, who acted as the middleman, cooperated with the police and explained how it was done. Most importantly, he mentioned the name of Marian Kočner, a businessman connected to the country’s ruling party, who was later charged with ordering the killing.

Ján had written extensively about Kočner, earning public disdain from the famously ill-tempered oligarch. In a combative phone call, Kočner even threatened to dig up dirt on the young reporter and his family. Police would later find surveillance photos of Ján and his fiance on a USB key in the oligarch’s house and connect him to the killers through text messages.

The murder trial began in January 2020. Both the middleplan and the shooter confessed and received reduced sentences of 25 and 15 years respectively. Kočner, his confidant Alena Zsuzsová, and the hitman’s driver Tomas Szabo pleaded innocent. The final verdict was read in a crowded courtroom in early September 2020. The judge found the driver guilty, but acquitted Kočner and Zsuzsová of the murder charges due to lack of evidence. The victims’ families left the courtroom in tears before the judge even finished reading his decision.

The acquittals incited outrage among a public that hoped justice had returned to Slovakia.

Prosecutors and legal representatives of the families filed an appeal. In 2021, the Supreme Court sent the case back to a lower court to reevaluate the evidence.

In the meantime, Kočner was sentenced to 19 years in prison for a different financial fraud involving the forgery of promissory notes – a case that was launched by Ján’s reporting. And Alena Zsuzsová was sentenced to 21 years for her involvement in another assassination in 2010.

Their new trial for the murders of Ján and Martina will begin this spring. It will likely be merged with other charges Kočner and Zsuzsová are facing: an alleged 2018 plot, never carried out, to murder two prosecutors and a lawyer.

“According to what I know from the case file, my assassination was only in the early stage of planning,” said that lawyer, Daniel Lipšic, who was elected the head of the special prosecutors’ office in 2021. “It was postponed because it was considered risky. Then the order for Ján Kuciak’s assassination came, which was a priority for Kočner.”

If the murder cases are merged, they are expected to become much stronger, and Kočner will be likely to spend the rest of his life in prison.

A Lucky Break and a Reckoning

While searching Kočner’s properties, police collected laptops, USB sticks and even guns. But what they didn’t find was his phone. Lead murder investigator Júhas recalls an earlier missed opportunity: “In the forged promissory note case, I contacted the investigator and asked about the phone,” he said. “He told me Kočner’s lawyer took it. So we narrowly missed the chance.”

But in the end, investigators got lucky, obtaining not only one but two of Kočner’s phones. While in pretrial detention for a different fraud, Kočner entrusted a confidant with not only his phones, but also their access codes. In the end, the confidant decided to give him up, and handed these phones over to the police.

Fortunately for investigators, they contained years of messages from an encryption application called Threema that Kočner used to discuss sensitive matters with a wide range of people including judges, prosecutors, oligarchs and law enforcement intermediaries. Since investigators had the physical phones and access codes, the encryption made no difference.

Read more"
14,https://americanfreepress.net/argentine-prosecutor-suicided-by-mossad/,Argentine Prosecutor Suicided by Mossad ? – American Free Press,22/02/2022,United States,53d64421-6357-3cab-0b7e-8772c97b89dc,"• Killed hours before releasing bombshell on 1994 terror attack.

By Dave Gahary —

The obvious assassination of an Argentinian prosecutor bent on proving the Islamic Republic of Iran’s responsibility in the 1994 bombing on the Argentine Israelite Mutual Association (AMIA) building in Buenos Aires was clearly the work of Israel’s national intelligence agency, Mossad. Over the past two decades it has been shown that the attack, the deadliest bombing ever in Argentina, was the work of the Zionists, who were embroiled in a bitter political fight in Israel after the olive branch of peace was offered to the Palestinians by Israeli prime minister Yitzhak Rabin.

The bombing of the Jewish Community Center, which killed 85 Jews and injured several hundred others, was the supposed work of a suicide bomber, and was immediately blamed on Iranian terrorists, although the alleged vehicle was never found and no evidence of Iran’s involvement was ever found. Significantly, Iran has a very large Jewish population who are not subjected to any discrimination due to their faith. Israel, however, has a long history of murdering anyone they see fit, including Jews and Americans, in false flag terrorist attacks for political causes, the most notable being the 1954 Lavon Affair—a failed series of bombings carried out by Egyptian Jews recruited by Israeli intelligence and designed to be blamed on Egyptian Muslims.

The prosecutor, 51-year-old Natalio Alberto Nisman, was a Zionist Jew and the chief investigator of the 1994 bombing. On January 19, Nisman was found dead at his home in Buenos Aires the day before he was set to present evidence of his inquiry of the bombing to Argentina’s congress. He was found by his mother in a pool of blood next to a .22 caliber handgun dead from a single shot to his head. The gun belonged to his assistant who had lent it to him. Paraffin tests showed no gunshot residue on Nisman’s hands and there were no signs of a struggle. Nisman knew he had information that would create a stir, telling a reporter on January 14 that “I could be dead by the end of this.”







Historians have shown that only hardline elements in Israel profited from the AMIA bombing. On July 1, 1994, Prime Minister Rabin allowed Yasser Arafat to return to Palestine from exile. Just two weeks later, the AMIA building was bombed. A few months later Rabin was assassinated in Israel by Yigal Amir—a radical right-wing Jew—punishment for Rabin’s dovish Labour Party policies. Amir was a member of the fanatical settlers’ movement, connected to Shin Bet, Israel’s internal security department, which Rabin was trying to rein in.

Those knowledgeable with the 1994 bombing suspect that Nisman may have uncovered evidence of Israeli involvement in the operation, which would need to be suppressed.

Ralph Schoenman, author of The Hidden History of Zionism, points to the 2013 “memorandum of understanding” Argentina signed with Iran, establishing a “truth commission” to investigate the AMIA bombing.

The fact that Argentina demanded a new investigation involving Iran as a co-investigator with the Argentinean authorities themselves “makes clear that within Argentina the realization has become quite substantial that this event has vanishingly little to do with Iran and everything to do with an intrigue that requires looking elsewhere,” said Schoenman.

“The apprehension of the Israeli authorities is well founded,” said Schoenman, “because that’s where the finger will be pointed when the evidence is in.”









With around 250,000 in the country, about .5% of the population, Argentina has the largest Jewish population in Latin America."
15,https://www.britainnews.net/news/272401225/top-uk-court-denies-assange-permission-to-appeal-us-extradition,Top united kingdom court denies Assange permission to appeal U . S . extradition,18/03/2022,United Kingdom,086fb01d-dc1c-f400-9865-5ef842cf6ff5,
16,https://www.nhregister.com/news/article/Taliban-detain-journalists-over-report-on-TV-show-17011024.php,Taliban detain journalists over report on TV show censoring,18/03/2022,United States,b77b3ef9-d42f-2cd0-bc91-0a41fd7641ad,"KABUL, Afghanistan (AP) — The Taliban have released three employees of Afghanistan's largest television station who were detained over a report that the country's new rulers had banned all broadcasts of foreign drama series, a channel executive said Friday.

Three staffers from TOLO TV were taken from the station on Thursday evening, according to Khpalwak Sapai, head of TOLONews department and one of the arrested. Sapai later said that he and Nafay Khaleeq, the station's legal adviser, were released within hours later Thursday.

Journalist Bahram Aman, a news presenter, was kept in custody overnight and released on Friday evening, the station said.

Moby Group, the media company that owns TOLO TV, said the detentions were the result of the station reporting “about the banning of the foreign drama series” — a decision made by the Taliban-appointed Ministry for the Propagation of Virtue and Prevention of Vice.

The Taliban gave no explanation for their ban, the latest restriction imposed since their takeover of the country in mid-August.

TOLO TV is an Afghan-owned media company with interests in South and Central Asia as well as the Middle East and Africa.

The United Nations and the Committee to Protect Journalists decried the arrests and demanded the Taliban stop harassing Afghan journalists and stifling free expression through threats, arrests and intimidation.

“The Taliban must immediately ... stop detaining and intimidating members of the Afghanistan press corps,” a statement from CPJ said.

The U.N. mission in Afghanistan expressed “its deep concern about the detentions of journalists and the ever increasing restrictions being placed on media in Afghanistan.” The mission, known as UNAMA, said on Twitter: “Time for the Taliban to stop gagging & banning. Time for a constructive dialogue with the Afghan media community.”

The Taliban did not respond to requests for comment from The Associated Press.

Since sweeping back to power last August, the Taliban have sent erratic signals about what the media landscape will look like under their rule, with international journalists sometimes welcomed and Afghan media often attacked.

The ranks of journalists in Afghanistan thinned dramatically during the chaotic days of the U.S. withdrawal last August when tens of thousands of Afghans fled or were evacuated by foreign governments and organizations. Many who stayed, and even those who have not had run-ins with the new Taliban rulers, say they are afraid of what tomorrow might bring.

The majority of TOLONews reporters and producers are women. Sapai, the station's executive, said he had made a special effort to recruit and train Afghan women journalists.

In December, Reporters Without Borders and the Afghan Independent Journalist Association said that 231 out of 543 media outlets had closed, while more than 6,400 journalists lost their jobs after the Taliban takeover. The outlets closed for lack of funds or because journalists had left the country, according to the report."
17,http://www.msn.com/en-us/news/world/taliban-reportedly-arrests-over-story-on-censoring-report/ar-AAVeCnn,Taliban reportedly arrests over story on censoring : report,18/03/2022,United States,e719e716-4cf1-0fc8-7c75-5b16647dcac7,"© KARIM SAHIB/AFP via Getty Images Taliban reportedly arrests journalists over story on censoring: report

The Taliban arrested three journalists from TOLO TV Thursday night, according to the Afghan television station.

The three employees were detained after airing a story about the Taliban's censorship of a foreign drama series in Afghanistan.

TOLOnews head Khpalwak Sapai and colleague Nafay Khaleeq, the legal adviser to TOLO TV, were released hours after their arrest. Station presenter Bahram Aman remains in custody as of Friday.

Aman told the TOLOnews team on a phone call Friday that the Taliban have promised to release him after two meetings.

Officials from the Taliban's General Directorate of Intelligence took the three employees into custody after nightfall on orders from the Ministry for the Propagation of Virtue and Prevention of Vice.

The United Nations Assistance Mission in Afghanistan (UNAMA), which was recently extended for another year, condemned the Taliban's suppression of journalism.

""UNAMA expresses its deep concern about the detentions of journalists and the ever increasing restrictions being placed on media in Afghanistan,"" the mission wrote. ""Time for the Taliban to stop gagging & banning. Time for a constructive dialogue with the Afghan media community.""

The Washington, D.C.-based Committee to Protect Journalists released a similar statement, calling on the Taliban to ""immediately release TOLOnews journalist Bahram Aman, and stop its intelligence agency from arbitrarily arresting and intimidating media personnel.""

It continued: ""Afghanistan's once thriving independent media community cannot operate effectively under constant Taliban threats and harassment.""

The Taliban took over the Afghan government shortly after U.S. troops began exiting the country last year, a move that raised concerns globally about human rights in Afghanistan."
18,https://www.cbsnews.com/news/taliban-journalists-detention-censorship/,Taliban detains journalists over report on censoring of TV shows,18/03/2022,United States,4e27a368-1d89-353d-dd7c-cade245c8d5b,"One Afghan family put daughters in charge of restaurants to send a message to women worldwide

Kabul, Afghanistan — Taliban intelligence men arrested three staff members of TOLO TV, one of Afghanistan's largest television stations, a channel executive said Friday.

The country's new rulers apparently didn't like a story the broadcaster aired on their decision to ban foreign drama series from local television, said Khpalwak Sapai, head of TOLONews, who was among the three arrested.

Sapai, and Nafay Khaleeq, the station's legal adviser, were released within hours, but the station presenter, Bahram Aman was still in custody Friday, Sapai told The Associated Press.

He's described by Agence France-Presse as ""one of Afghanistan's top news presenters.""

One of Aman's relatives, who spoke on condition of anonymity, told AFP, ""Our whole family is concerned. Previously... they had threatened him.""

The intelligence officials from the Taliban's General Directorate of Intelligence (GDI) came shortly after 8 p.m. Thursday to arrest the three. Sapai said the station was still seeking Aman's release.

Moby Group, the media company that owns TOLO TV, said the detentions were ""for publishing Tolo news about banning of the foreign drama series,"" a decision made by the Taliban's Ministry for the Propagation of Virtue and Prevention of Vice.

The Afghan-owned media company has interests in South and Central Asia as well as the Middle East and Africa.

The arrests were met with international outcry, including broader demands from the U.N. and the Committee to Protect Journalists (CPJ) for the country's rulers to stop harassing local journalists and stifling free expression through threats, arrests and intimidation.

""The Taliban must immediately release journalist Bahram Aman, a news presenter at independent broadcaster TOLOnews, and stop detaining and intimidating members of the Afghanistan press corps, "" a statement from the U.S.-based CPJ said.

The United Nations Assistance Mission in Afghanistan (UNAMA) urged the same.

""UNAMA expresses its deep concern about the detentions of journalists and the ever increasing restrictions being placed on media in Afghanistan,"" it said on Twitter. ""Time for the Taliban to stop gagging & banning. Time for a constructive dialogue with the Afghan media community.""

Neither the Taliban's information and culture ministry nor its intelligence agency responded to requests from the AP for comment.

The CPJ statement said the Taliban's intelligence service denied the arrests.

Since sweeping back to power last August, the Taliban have sent erratic signals about what the media landscape will look like under their rule, with international journalists sometimes welcomed and Afghan media often attacked.

The ranks of journalists in Afghanistan thinned dramatically during the chaotic days of the U.S. withdrawal last August when tens of thousands of Afghans fled or were evacuated by foreign governments and organizations. Many who stayed, and even those who haven't had run-ins with the new Taliban rulers, say they're afraid of what tomorrow might bring.

The majority of TOLONews reporters and producers are women because Sapai, who was briefly detained, said he made a special effort to recruit and train Afghan women journalists.

In December Reporters Without Borders and the Afghan Independent Journalist Association found that 231 out of 543 media outlets had closed, while more than 6,400 journalists lost their jobs after the Taliban takeover. The outlets closed for lack of funds or because journalists had left the country, according to the report.

AFP notes that when they regained power, the Taliban initially prohibited TV stations from broadcasting dramas or soap operas that didn't have Islamic themes. Though the ban was loosely enforced, AFP says, ""They appear now to be more strictly enforcing that directive, which TOLOnews reported on."""
