,url,title,date,country,id,text
41,https://www.sbs.com.au/news/dateline/the-nonviolent-indigenous-movement-in-pakistan-facing-renewed-threats-from-the-taliban,The nonviolent Indigenous movement in Pakistan facing renewed threats from the Taliban,10/02/2022,Australia,0a92de69-b9cf-b6ad-fe73-bed85905c95d,"Kashef Khan grew up in Pakistan’s tribal areas during a time of relative peace. Now it’s a region scarred by decades of war.





He was born in the district of North Waziristan, on the border with Afghanistan, after the USSR’s withdrawal from Afghanistan in 1989. Kashef, now 28, describes his childhood as being quite normal, growing up like generations of Indigenous Pashtuns before him.

Ethnic Pashtuns make up roughly 15 per cent of Pakistan’s population of about 238 million, with many also living across the border in Afghanistan. The fiercely independent tribal group is traditionally governed by Pashtunwali, an unwritten customary law passed down by respected elders for centuries.

The Durand Line forms the Afghanistan-Pakistan border and splits traditional Pashtun land between the two countries Source: SBS

But Kashef says his life changed when the United States invaded Afghanistan after 9/11.

He says the US attack created a huge influx of refugees across the border.

“We lived in the borderland, so we would hear the bombardment and the noise. I was in grade two or three around that time,” he tells SBS Dateline.

After the Taliban government was toppled in 2001, Kashef says many fighters took refuge in his area. He says they share the same ethnicity, so it was easy for them to cross the border and integrate.

“The language is the same, the origin is the same, same bloodlines and everything. It makes sense that it was so easy,” he says.

But Kashef says the Taliban’s strict interpretation of Islam was at odds with the customary laws administered by tribal elders.

“They became a dominant part of society. Around 1,500 elders were murdered. The Taliban were trying to become the authority.”

Kashef says everyone from his village was terrorised, regularly reminded of the consequences of speaking out.

Kashef Khan grew up in the early 90s in North Waziristan Source: Supplied

“We would always see mutilated bodies on our way to school. They were usually the elders of certain tribes.”

At this point he apologises for becoming agitated, seeming to recognise his anger building.

“For a small kid, this influences your mind,” he says. “It influenced a lot of us. Some of us were radicalised to join them and carry out suicide attacks.

Kashef was eventually accepted to study economics in the Pakistan capital Islamabad, while Pakistan’s military carried out a major offensive against the Taliban, aimed at pushing them out of the tribal areas. His parents became internally displaced people as a result of the violence.

Kashef (front, right) organised with friends from his university to deliver aid to the camps for internally displaced people Source: Supplied

When it was safe to return at the end of 2017, Kashef and his family found his town in ruins.

“Everything was destroyed. Even my house. Everything was finished,” he says.

It was at this time that a movement founded by a group of students including a veterinary science student named Manzoor Pashteen was starting to gain traction.

“Things were changing. The way of thinking was changing,” Kashef says.

PTM leader Manzoor Pashteen (centre) with Kashef Khan (right of Pashteen) and other PTM members Source: Supplied

Rise of the PTM

The Pashtun Tahafuz Movement was born out of what Kashef describes as longstanding discrimination against Pashtuns in Pakistan, as a result of their different language and complexion. The movement gained a huge following in 2018, after the staged killing of aspiring model Naqeebullah Mehsud by a senior superintendent of police in Karachi.

Kashef says Pashtuns were the victims of the government’s military campaign against the Taliban.

“[The PTM] is totally nonviolent. We were demanding constitutional and human rights.”

The movement regularly holds 'jalsas' or public demonstrations and sit-ins across the country.

Supporters of Manzoor Pashteen, leader of the PTM, hold pictures of their missing relatives as they listen to his speech during a gathering in Swat. Source: EPA

Bilquees Daud from the Centre for Afghanistan Studies at India’s Jindal Global University, agrees that the movement pursues a policy of nonviolence.

“The nonviolent legacy among Pashtuns started with Khan Abdul Ghaffar Khan, also known as the frontier Gandhi,” Ms Daud says. “His legacy has deliberately been removed from the history of Pashtuns.”

According to Ms Daud, the PTM has three main objectives: the establishment of a truth and reconciliation commission to investigate extrajudicial killings; securing the release of missing people or information as to their whereabouts; and the removal of landmines from Pashtun tribal areas. Authorities claim to have cleared at least 48,000 landmines in the region.

Dr Ayesha Jehangir, from the UTS Centre for Media Transition, is a former war journalist from the region, and says the movement wants to “demilitarise the Pashtun youth.”

“War is embedded in Pashtun culture, not violence, I want to make that distinction clear,” Dr Jehangir tells SBS Dateline. “This culture of war goes back well past the Russian invasion of Afghanistan.”

“Pashtuns are an Indigenous ethnicity in Pakistan and one of the most underrepresented, oppressed and marginalised in terms of education, health and political representation,” Dr Jehangir says.

She says the PTM’s protests in favour of rights for Pashtuns have been wrongly labelled by the government as anti-state, terrorist activities.

“To date there has not been a single attack by the PTM, neither has any member of the PTM ever been involved in any terrorist activities,” she says.

Allegations of state persecution

As a result of these alleged terrorist activities, Dr Jehangir says Pakistani media outlets face huge challenges when reporting on the PTM.

“The reason the media is instructed not to cover the PTM is because it talks about the missing Pashtun people, it talks about the military operations in northern Pakistan.”

Batoor* is a former journalist who became supportive of the PTM. He also talks of the “establishment” warning media outlets not to report on PTM rallies.

“In 2020, there was a big PTM gathering in Swat, and there were no TV or newspaper reporters covering that. My friend tried to report it, but he received a penalty for covering the rally,” Batoor says.

He decided to leave journalism to pursue another profession, but he came under more pressure from the government for his links with the PTM.

He has received numerous desist letters from the authorities, which he says is common for members of the PTM.

Letters like this are commonly sent to members of the PTM Source: Supplied

“When someone from the PTM speaks, they are speaking truths that the government doesn’t want to be made public. They say the government supports the Taliban in order to push the US back,” Batoor says.

SBS Dateline had organised an interview with PTM leader Manzoor Pashteen. However on Thursday, reports emerged of an attack on Mr Pashteen and the vehicle convoy he was travelling in. Regional PTM coordinator Noor Bachar, who was travelling with the group, is understood to have been shot, while Mr Pashteen escaped injury.

The Taliban’s return to power

While people like Batoor fear the government’s alleged censorship and oppression of the PTM, the Taliban’s victory and consolidation of power in Afghanistan is quickly becoming another major threat.

“PTM supporters are extremely worried about the Taliban coming back. They will kill all the PTM supporters first,” he says.

""You have to put everything aside. You must accept that they could kill you, they could behead you. If you can do all of these things, you can be part of the PTM. Otherwise it is too dangerous.""

Dr Jehangir also sees the potential for conflict between the PTM and the Taliban in the borderland.

“The PTM is anti-war and pro-education. The Taliban is pro-war and anti-education. How can these two exist together?”

Talks are continuing in Norway between the Taliban and Western diplomats, with the issue of

reported to be high on the agenda.

Bilquees Daud describes the Soviet invasion of Afghanistan as the beginning of an “era of radicalisation” when fighters from around the Islamic world formed the mujahideen in opposition to the USSR-aligned government.

You have to put everything aside. You must accept that they could kill you, they could behead you. If you can do all of these things, you can be part of the PTM. Otherwise it is too dangerous. - Batoor

“The era of radicalisation really changed village life for Pashtuns,” Ms Daud says.

“Pashtunwali was banned and replaced by Sharia law. Pashtun women never wore the burqa. That was all changed by the mujahideen and the Taliban. The way the Taliban beat women in the streets was totally unimaginable in Pashtun society.”

Ms Daud has observed commentary linking the Taliban and Pashtun nationalism, which she says is incorrect.

“Pashtuns are not just the Taliban. They are also people like [PTM founder] Manzoor Pashteen,” she says.

For Kashef Khan, who is now studying his PhD in Australia, fear of the Taliban will not stop him from returning home.

Kashef is now completing his PhD in Sydney Source: Supplied

“No one knows what will happen next, but one can’t just stop moving out of fear,” he says.

“My experience is living in these conditions all my life, so it won’t scare me. I’m hoping for the best.”

SBS Dateline sent a list of questions to the Pakistan High Commission in Canberra, but did not receive a response.

(*Name changed for security reasons)"
42,https://www.desertsun.com/story/opinion/contributors/2022/03/11/im-censored-russian-journalist-but-report-truth-ukraine/9447147002/,"Im a censored Russian journalist , but I report the truth on Ukraine",11/03/2022,United States,be902aa4-59bd-102c-7ac7-c5201413839f,"I'm a censored journalist in Russia, risking jail to tell the truth on Ukraine

Editor's note: Yevgenia M. Albats is editor and CEO of a now-blocked political portal, The New Times. She was a talk show host at the now-closed Echo Moskvy broadcasting. She is the author of the book ""The State Within a State: The KGB and Its Hold on Russia — Past, Present, and Future.""

Albats resides in Moscow. This was originally published in USA TODAY and carries her byline with her permission.

——

Vladimir Putin invaded Ukraine at 4 a.m. on Thursday, Feb. 24. I did not catch the moment. I was in the hospital, a week after a total knee replacement surgery, still in pain and on sleeping pills.

My surgeon, himself half Ukraine, walked into my room: ""The war has begun,"" he said and sobbed. ""My friends, my relatives — what will happen to them …""

I felt sorry for him, but my brain was rolling crazy: Did my news people catch the news? Who should I ask to write an analysis right away?

'Ministry of Truth'

I was terrified by the news but not surprised. I was aware that Putin was to start a war sooner or later. I think it became pretty apparent after he amended the Russian Constitution in the spring of 2020, making himself president for life.

An external enemy, a threat capable of uniting the nation under the well-known Soviet wartime slogan ""Fatherland is in danger!' was in his sick mind a precondition for a successful transfer of his presidency into dictatorship, or even a monarchy with divine origin and powers. The validity of which no one was to question or to challenge.

My New Times was running the news, the op-eds came even when I was still asleep, and I went on air live with events and analysis on my YouTube channel right from my hospital ward.

I asked to be released home the next day.

On Feb. 26, I got a letter from the Russian agency in charge of censorship. It officially is the Federal Service for Supervision in the Field of Communications, but we call it the Ministry of Truth. The letter said that New Times' stories (as well as those by nine other outlets) about the ""shelling of Ukrainian cities and the death of civilians"" were ""untrue information.""

In fact, according to the agency, use of the words ""war,"" ""invasion"" and ""offense"" concerning events in Ukraine were out of the question. The bombardment of Ukrainian cities with missiles must be called a ""special operation.""

On Feb. 28, the New Times site was blocked on the territory of the Russian Federation. OK, we said, our readers inside the country are to use the VPN (virtual private network), which allows pretending that your phone or laptop is located in, say, Sweden or the United States. We were facing charges, fines and a court hearing. But all that was part of being an independent media in an authoritarian country. I was not concerned.

My father's safe house

A much more terrifying thought was that my nation, Russia, where I was born and of which I am a citizen, had started a war of conquest.

At 8 p.m. that day, I had my regular talk show at freewheeling Echo Moskvy broadcasting, as I had each Monday for 19 consecutive years. A reporter working in the Ukrainian capital of Kyiv, a military expert and a political scientist were scheduled to be my guests.

I started with a story about the southern Ukrainian city of Nikolaev (Mykolaiv), which was already under the offense of the Russian troops. Video footage from Nikolaev suggested heavy shelling; vehicles were on fire, glass in apartment building windows was broken, sidewalks were riddled with bullets.

I knew the city. I was there a couple of years ago because of my father's story. Mark Albats parachuted into the territory of Nazi-occupied Ukraine in September 1941. His safe house, where he kept a radio transmitter, was on 14 Pushkinskaya Street in Nikolaev. I immediately recognized the city and the street when I saw the footage.

My dad fought the Nazis to defend his motherland, Russia, then part of the USSR. Thanks to G-d, my father is long gone to a better world, and he did not get to see that now Russia is attacking Ukraine and making ruins out of Nikolaev as Nazis did eight decades ago during World War II.

Smothered free press, in just a week

The show went well. I did not know it was my last show. Three days later, on March 3, Echo Moskvy was taken off the air. The next day, just last Friday, the only independent TV channel, Dozd (TV Rain), at which I was a frequent political commentator, was also shut down.

Well, I told myself, the situation was not lovely, but after all, I lived in the totalitarian Soviet Union. I was a student at Moscow University's Department of Journalism when the Soviet army invaded Afghanistan. Things went from bad to worse for those not loyal to the communist party and the KGB.

I survived then. Sure enough, I will survive now, as YouTube is running, my channel is getting an audience and Google is placing ads.

Little did I know.

On Friday, Russian State Duma passed three new repressive laws. Any information about the war in Ukraine that does not fit the narrative of the Russian Ministry of Defense is to be considered fake news and punishable for up to 15 years in jail.

It prompted whatever nonstate media left to shut down their websites or publicly announce that their news department is closed from now on. It is to say that they will not cover the war in Ukraine anymore. In a matter of a single week, independent media ceased to exist in Russia.

Hundreds if not thousands of professionals left Russia — the best editors, reporters, filmmakers, analysts, professors of economy and political science. Business people with cash handy flew to Dubai and Arab Emirates. Those with modest means choose Central Asia.

My young reporter wrote to me that she was ""urgently getting married"" because she did not want to be alone in exile. She did not have enough savings for a ticket to Yerevan (capital of Armenia). So she ended up looking for one to Uzbekistan. I hope she will get there in one piece with her loved one.

As for me, I am planning to do a show on my YouTube channel.

Several days ago, I was awakened at 3 a.m. by a friend: ""Be ready, they (i.e., police or FSB) will come to arrest you around 6-7 a.m.""

I took a shower, got dressed, put a new bandage on my knee, packed a bag with essentials and went back to sleep.

They did not come. But I keep the bag by the door.

Polls in dictatorships

You may ask — as I ask myself: Why did Putin and his supporters decide to kill all independent media in Russia? After all, we were just leftovers — a small liberal ghetto amid the rich and powerful state media, which control every TV network capable of covering the country of 11 time zones.

If you read the polls conducted by the two state-owned pollsters, their numbers suggest that Putin and his war have the support of two-thirds of those polled. Yet, polls in dictatorships bear no value — people are afraid to say what they really think.

Are there people who support the war? Oh yes, one can see cars with the letter Z chosen as a recognition sign for the Russian military vehicles in Ukraine drawn on the side doors of the expensive SUVs driving through Moscow.

Yet, it is also true that more than 13,500 predominantly young people got arrested, and face 15 to 30 days in jail, for anti-war protests, which erupt daily in many cities across Russia.

After the first days of the war, the Kremlin realized that independent news coverage attracted millions of Russians looking for information beyond the propaganda machine. In 2008, during a short war against Georgia, the Kremlin lost an information war to the liberal Russian media.

This time, Putin chose not to take chances. He signed a death order for the media that had the courage to tell the truth of the war of his making.

All that is left are his Kremlin media — TV channels and radio stations.

This year, like all the years before, on the anniversary of the start of World War II in the Soviet Union, they'll broadcast one of the most famous songs of the war, which begins:

""On June 22d, At exactly four o'clock Kyiv was bombed, We were told that the war had begun.""

As I write those words, Kyiv is under siege by Russian troops."
